id,user_name,text,write_date
1341535167060426753,Montani semper liberi,"이렇게 엘런 머스크가 애플카가 기술적으로 말도 안 되고, 애플이 테슬라 인수 협상조차 거절했다는 걸 공개적으로 밝히는 건 그만큼 엘런 머스크가 애플의 전기차 시장 진입에 대해 위협을 느끼고 두려워한다는 것을 반증한다고 본다.",2020.12.23
1341531647548637185,주주들,"전일 애플카 생산소식에 자율 주행관련주들이 강세를 보였으며,대성엘텍, 인포뱅크등이 상한가를 기록.테슬라에 이어 애플카까지 테마가 형성된 모습입니다.인공지능칩, 라이다등 순환매가 나올수 있는지 지켜보시기 바랍니다.",2020.12.22
1341528299122487296,북엇국,머스크가 테슬라 팔려고 쿡에게 미팅신청했다가 거절당한걸 왜 지금 털어놓냐. 애플이 전기차 만든자고 하니 테슬라 주가떨어져서 그런거냐..  https://t.co/SMdStyuWie,2020.12.22
1341527718169509889,예서의책(경진출판),"애플 VS 테슬라, 전기차 시장에서 격돌? [김현석의 월스트리트나우] (출처 : 한국경제 | 네이버 뉴스) https://t.co/aUGIbkWkGT",2020.12.22
1341524219893432320,eggry,"일론 머스크, 과거 팀 쿡에게 테슬라 인수 제안했다고 트윗해 https://t.co/l8F2r6Aodo",2020.12.22
1341523915902832645,위키트리 WIKITREE,애플↑ 테슬라↓ https://t.co/AFS4Zj9km0 #신한금융투자 #아프리카TV #엘비세미콘,2020.12.22
1341522018592718848,허프포스트코리아,"일론 머스크가 과거 테슬라를 애플에 팔려고 했으나 팀 쿡이 거절했다고 밝혔다.현재 테슬라 시가총액은 6000억달러(약 663조9000억원)가 넘는다. https://t.co/qhQwIAazSr",2020.12.22
1341514374872145921,블로터,애플에 팔릴 뻔했던 테슬라…머스크 CEO “어려울 때 매각하려고 했다” https://t.co/mEwcatugtX,2020.12.22
1341511595046813696,지디넷코리아,"일론 머스크 ""팀쿡, 테슬라 인수 제안 거절했다"" https://t.co/3B57ds4I1U https://t.co/LUTjwLzj3f",2020.12.22
1341505101840613376,투자/주식의 생활화 퇴직 오과장,"애플 테슬라인수설이 그냥 나온건 아녔고,성장주 나스닥 대표주가애플에서 테슬라로다시 애플로..자율주행 아이카 키우기머라도 인수해얄건데",2020.12.22
1341504332210978816,CoreCorean,"렙틸 땜시 머하나 되는 일이 없나봉테슬라 독일 기가팩토리, 장지뱀에 공사 중단 (출처 : 파이낸셜뉴스 | 네이버 뉴스) https://t.co/2UzGxVRGpX",2020.12.22
1341499189054697472,보부상,항상 예상을 뛰어넘는 언행으로 사람들을 놀라게 하지. 하긴 그 황당함이 지금의 테슬라와 스페이스X 를 만들긴 했지만.,2020.12.22
1341490669336973312,Mighty_Katsusando💫,이젠 테슬라 네려가고 애플가나?,2020.12.22
1341489575840006144,라샷,팀쿡한테 지금 1/10 가격으로 테슬라 인수하라고 했는데 안 받아들였나보네,2020.12.22
1341488687238942720,연합뉴스,"자녀에게 물려주고 싶은 해외 주식은? ""테슬라·애플""https://t.co/KY15ccDb4f자녀에게 물려주고 싶은 장기투자유망 해외종목으로 테슬라와 애플이 꼽혔습니다. https://t.co/RaVo9TpvpO",2020.12.22
1341475248261099520,리아,"테슬라처럼 나오면타이어 (ps4, 별매) +1,000,000원모터 업그레이드 + 3,990,000원모터 pro 업그레이드 + 5,990,000원모터 pro max 업그레이드 + 7,990,000원대시 디스플레이 LCD - 100,000원대쉬 디스플레이 LED(기본)대쉬 디스플레이 OLED + 899,000원대쉬 아이패드 추가 옵션 + 1,029,000원",2020.12.22
1341471406144380928,리아,"간단하면서도 프리미엄을 추구하는 회사니까 신기술 이것저것 때려넣는거보단 신뢰성 안정성을 최우선으로 생각할거고.. 내부는.... 테슬라 처럼 중간에 커다란 화면 박고 맥,아이폰,워치로 컨트롤 할 수 있게.. 만듣ㄹ듯. 가격은.. 타이칸이랑 동급이거나 조금 더 비싸게",2020.12.22
1341443280307970050,Thoth,"테슬라 Hype이라고 하나, 테슬라 버블이라고 하나. https://t.co/DNeOMJxmfz",2020.12.22
1341432851552587777,𝕕𝕦𝕕𝕖𝕣𝕛𝕖𝕖,집 &amp; 테슬라(주식),2020.12.22
1341422573561638914,임두만(신문고뉴스 편집위원장),"[신문고뉴스] 소비자주권 ˝테슬라 전기차 단전시 외부 탈출 불가, 리콜해야˝ https://t.co/o1I3wOUagU",2020.12.22
1341422408813559809,미르라1 #0863,"옆에서 오억 테슬라에 꼴아박고 십퍼센트 손해본 기앗쵸가 깔깔웃고있음 그놈이그놈이죠?? 저짞끝에서 펫시가 ㅎㅎ...하고 난처하게 웃으면서 오육프로 오른 레버리지 etf 매도한 돈 예수금으로 들고있을듯 아근데 판지 이틀 안돼서 이체가 안되는통에 현재금액 0원이라 꼴찌할듯...",2020.12.22
1341418405136461824,우바 ฅ^._.^ฅ,얼하 중간중간 뛰어넘었더니 묵미우 캐릭터 인지부조화온다 ㅋㅋㅋㅋㅋㅋ 세계제일 ㅋ짱구에서 갑자기 벤츠도 아니고 테슬라 되어버림,2020.12.22
1341418161443274752,StoryFeed,애플카 2024년 자율주행 전기차 출시 테슬라에 미칠 영향은 https://t.co/rTVnlelmd7,2020.12.22
1341415114440757249,용,하지만 전기차 시장은 팽창 중이고 현재의 테슬라는 총알이 풍부하니 상상하는 무엇이든 할 수 있다는 점은 희망적이다.,2020.12.22
1341415113392234497,용,"테슬라 경쟁력의 본질은 선점효과 + 가성비라고 본다. 테슬라의 빌드 퀄러티는 구리다. 그리고 나는 이게 하루 아침에 바뀔 수 없는 회사 DNA라고 생각한다. 뭔가 바뀌지 않는 이상, 시장이 성숙할수록 불리해지는 게임이다.",2020.12.22
1341409537639800837,ForceArcher,"Your $ALT Season is here.But happened in EV $SPAC$BTC $ETH $XRP$TSLA $SPAC $JKS $NNOX $BTC $ETH $AAPL #테슬라 #애플 $ACB $NIO $SBE $SNOW $FROG $U $NIO $BA $BABA $ZM $UBER $CIIC $THCB $QELL https://t.co/5542e3jKgg",2020.12.22
1341405968807161860,naeagara,"@2_yslhan …테슬라 차기 모델인 사이버트럭의 경우 방탄유리까지 장착돼 사고 시 인명 구조가 더 어려울 것으로 예상된다는…?",2020.12.22
1341405780877189123,이직,"감쪽같이 깨끗해진 테슬라 대시보드하이패스 매립 성공~ https://t.co/fHmIr2MW9L",2020.12.22
1341403718646951936,naeagara,"전력 끊기면 문 안 열린다?…심각한 안전결함 노출한 테슬라?사고에서 가장 문제가 됐던 것은 화재 발생 뒤 차량 문 열기 어려워 차주인 윤 씨의 구조가 늦어졌다는 것카123텍 대표 박병일 명장""전자식이 기계식보다 편리하고좋긴하지만 컴퓨터나 센서 쪽 문제생기면…https://t.co/oEm3o56jkx",2020.12.22
1341402677595545603,flying_lion,기관들이 테슬라를 695불에 샀으니깐.. 그 아래에서 사면 무조건 이익이 되지 않을까? 더 사고싶다 ㅋㅋ,2020.12.22
1341402086668419072,투자/주식의 생활화 퇴직 오과장,"테슬라 인재 영입한 애플···아이폰 이어 '아이카' 출시 https://t.co/ak24fmMfDx애플은 동시에 선택과 집중 전략을 택했다. 배터리에 집중하고 기타 수만개의 부품 제조는 협력 제조사에 맡긴다는 전략이다. 자율주행차의 핵심으로 주행 도로의 3차원 뷰 인지 기술애플 금일도 신고가",2020.12.22
1341399601811759112,한샹곰@정식애니프사,아 테슬라 ㅋㅋㅋㅋ 추매했더니 더떨어지내  또 추매해야지,2020.12.22
1341397409524576256,SangSang 🐰,"테슬라 애플 현대차 ... 미래의 자율주행 전기차 승자는 누가 될까? 재미지겠네 다행히 모두 내 포트에 비중이 큰 종목들임",2020.12.22
1341393442685988865,DHL,귀엽게 테슬라 1주 사봤다 귀엽네 진짜,2020.12.22
1341392899091673095,와가마마 꼬마귀(=맹금류),테슬라랑 마소 중에 뭘 추매할까,2020.12.22
1341387547306442757,와가마마 꼬마귀(=맹금류),테슬라 지금 추매하면 미친 짓일까,2020.12.22
1341387118883553281,allu@언제까지나µ's,이야... 한국 자본이 테슬라 주식을 8조원어치나...,2020.12.22
1341382058149462017,ForceArcher,"@DoctorSpac Sold 80% at $79Just sold the rest 20% No position on $QS nowBought this 2 months ago at $172nd biggest gainer after $TSLADO NOT TRADE EV $SPAC OWN IT.$TSLA $SPAC $JKS $NNOX $BTC  #테슬라 #애플 $ACB $NIO $PIC $CIIC $THCB",2020.12.22
1341381583098368006,박영석,"애플 전기차가 2024년 나올 수 있다고 ?내 생각엔 테슬라에게 호되게 당할것 같은데...😝그때쯤이면 시총 1위도 테슬라애게 내줬을것 같고...",2020.12.22
1341379797612556288,핑보이,"@LayeredInvest 필드에 한번도 안나가본 아마추어 골프가 스크린 골프에서 싱글 했다고, 필드에서도 싱글 칠거라고 말하는 것과 비슷한 생각이 듭니다. 원가 절감과 양산을 위한 피나는 노력과 많은 시행착오를 거치면서 전진하고 있는 우리 테슬라인데...",2020.12.22
1341378317769797632,ForceArcher,"Pre market continues After the news that $APPL is going to produce their own $EVEV $SPACs start soaring.Also $GOOG and Chinese $GOOG BAIDU are secretly working on EVs.Trend is unstoppable.DO NOT TRADE EV $SPAC OWN IT.$TSLA $BTC  #테슬라 #애플 $ACB $NIO $PIC $CIIC $THCB https://t.co/CN4HaY8iMT",2020.12.22
1341376795921137664,JokerMagic,테슬라 코일 https://t.co/eDxizsy4Gz,2020.12.22
1341375277478289408,99gnos77,책 제목은 찰스 모리스의 테슬라 모터스. 개정판이 나와서 새로 신청하긴 했는데 기다리기 싫어서 일단 2015년판 읽는중..,2020.12.22
1341375019880878080,DeepLife,테슬라 많이 까지만..  아이폰나오기전 삼성언플처럼. 현기차 나오기전에 항상 있을 일이라..    https://t.co/VfKqxoF0LU,2020.12.22
1341373588830470151,ForceArcher,@LayeredInvest 제가 보기엔 테슬라 현재 위치가 위험한게 아니고 기존 가솔린차 제조업체들이 도태될거같네요. 누가 경쟁에서 이기든 애플 구글 바이두 전기차중에 몇군데가 테슬라와 함께 계속 성장해나갈것입니다. 현재의 도요타 르노 GM 같이...,2020.12.22
1341372344057487360,99gnos77,완벽히 자수성가한 인물인것도 모자라.. 자신이 번돈의 대부분을 테슬라에 '투자'함. 우리나라 기업인들이 대부분(이라고 쓰고 전부라고 읽는다) 세습된 자본으로 회사를 운영하는걸 생각하면...,2020.12.22
1341371704220663809,rainbow,"2024년 `애플카`가 온다…테슬라 ""나 떨고 있니?"" - 매일경제 https://t.co/P1VrT3oNCZ",2020.12.22
1341371063968546817,99gnos77,테슬라와 일론머스크의 일대기를 2020년에 읽는일은 고문에 가깝다..,2020.12.22
1341370177775005702,Hal Magice,테슬라 완전 살인귀던데; 애가 안 그렇게 봤는데 음쩡 살벌하드라고...,2020.12.22
1341369911210209280,ForceArcher,"@LayeredInvest 애플의 막대한 자본력으로 스타트업 합병하면 기술 자료 확보는 초단축. 디자인, 브랜드파워, 고객충성도까지 고려하면 테슬라가 무시할 수준은 아닌듯",2020.12.22
1341369324141858816,졔리 Jye,"벼님과 벼님 친구분이랑 편식쟁이 폭난테슬라를 보고 순간 동공 지진했으나잘먹는거랑 편식은 다르지.. 호감스를떠올리며 납득참치스킨 너무 기여워요.. 아마 카지가 다 잡아준듯..우리집 지약 한구할배.. https://t.co/fsVOq0Chzx",2020.12.22
1341369105195048960,Daegwon Nacyot Kim,테슬라가 버크셔 시총 추월했네. 😮😮😮 #그냥그렇다는이야기 https://t.co/p6QDZsrNrs,2020.12.22
1341368438074167296,peter scott🇰🇷,@LayeredInvest 브랜드파워는 극강이긴한데ㅋㅋ테슬라 fsd자료를 모으려면 좀 오래걸리지 않을까 테슬라가 이미 많은 차를 팔고 데이터까지 구축하고 그래야지 애플차가 나올것 같은데 ㅋㅋ,2020.12.22
1341367854491287556,레이어드,"애플카? 말이 안되는데... 테슬라는 배터리, OS, 자율주행 등 천재CEO 아래서 미친듯이 만들어서 겨우 적자 면하고 있는데, 애플이 그것을 해낸다고... 아직 애플이 그 정도의 유연성이 있는 조직인가? 요즘 나오는 제품을 보면 딱 관료화된 조직인데... 물론 브랜드 파워는 극강!",2020.12.22
1341364200862404613,ForceArcher,"You should buy all the EV battery, lidar, and EV enhancements $SPACs because one day, one of them is going to work with $AAPLOr BUYOUT DO NOT TRADE $SPAC OWN IT!$TSLA $SPAC $JKS $NNOX $BTC $ETH $AAPL #테슬라 #애플 $NIO $SBE $SNOW $NIO $BA $BABA $ZM $UBER $CIIC $THCB $QELL",2020.12.22
1341363189284409344,ForceArcher,"Hope you listened to me And did not sell your stocksCause you might have to buy it higher with a risk of falling$TSLA $SPAC $JKS $NNOX $BTC $ETH $AAPL #테슬라 #애플 $ACB $NIO $SBE $SNOW $FROG $U $NIO $BA $BABA $ZM $UBER $CIIC $THCB $QELL",2020.12.22
1341362032587677696,노력하는 기획자 윤피디,비밀 풀린 ˙애플카˙… 테슬라보다 오래 달릴 車배터리 설계 (출처 : 아티스트리.. | https://t.co/jo0hqZ2lIj 블로그) https://t.co/7Zttrkdqkb,2020.12.22
1341353147357282304,희망별,"애플카!!비밀 풀린 '애플카'… 테슬라보다 오래 달릴 車배터리 설계 [애플, 자율주행 전기차 만든다] (출처 : 파이낸셜뉴스 | 네이버 뉴스) https://t.co/3bndhR75qO",2020.12.22
1341345260669026304,....,"모바일카지노 룰렛전략 육아용품 유럽여행 패션모델 유럽여행 뷰티템 테슬라 지갑 출장만남 출장마사지 출장샵   출장안마e0a72 https://t.co/PF5NqKIpcu",2020.12.22
1341344412970807298,큐큐함폭,테슬라옷 입은 아스카 ㄹㅇ 전설이다.....,2020.12.22
1341339270817087489,sungchi,왜 타임라인에 이런게 보이는지.. 자기 소개에 테슬라 어쩌고 써있으면 팔로우를 더 숙고해봐야 https://t.co/6khUTz21CP,2020.12.22
1341327021071192064,"로그뉴스 - 가상화폐,암호화폐","코인쉐어스 CSO ""BTC, 테슬라 대비 상승폭 크지 않아""https://t.co/dixvD5vj9Q",2020.12.22
1341324158722998273,RiA-출석.괭2약..10시엔 잡시다....,"아니시발 전승결정준다고하길래 존나 가볍게 테슬라랑 버준이 멀린 데려갔더니 미친 존나 하나 체력이 150만에 옆에 10만에 3브레이크있길래아 쉬바 메인 존나 개빡쎄게하네 했는데 쉬바 저거 고난도퀘였음?????????????고난도치곤존나 쉽게꺳는데(당혹0(우주당혹)",2020.12.22
1341321921342914562,잼,"우리집 달동네 빌라인데 주차장에 테슬라가 잇어 볼때마다....""의아""",2020.12.22
1341320995274063872,뤠벯쨩🍅,테슬라각성넘이쁘고좋은거같아요~~ 어케 중포를 튜바로바꿀생각을 ㅠ 날개장식이랑도 너무어울림,2020.12.22
1341318371539869696,JOIND(조인디),"""BTC, 테슬라 대비 상승폭 크지 않아"" 코인쉐어스 CSO https://t.co/YaVugfSodK https://t.co/sUj62ggKgd",2020.12.22
1341318069650509827,투자/주식의 생활화 퇴직 오과장,"애플 VS 테슬라…자율주행차 ‘스타워즈’ 벌어지나https://t.co/5Co9kg66q4",2020.12.22
1341312557613686785,핑보이,"@LayeredInvest 제 주변 사람들이 책을 계속 사고 있습니다. 점점 레이어드빠, 테슬라빠가 많아질 것 같습니다.",2020.12.22
1341297506999681024,Montani semper liberi,"애플이 2024년 자율주행자동차생산을 위해 박차를 가하고 있는것으로 알려지면서 테슬라와의 ‘한판 승부’가 벌어질 가능성도 점쳐지고 있다. 일부에선 애플이 단순히 시스템 개발을 넘어 기존 자동차업체를 인수해 자체개발한 자동차를 생산할 가능성이 있다고보는 상황이다.https://t.co/DdOzyLiPGm",2020.12.22
1341293830968995840,조드,삼성전자가 하만에 이어 쌍용차를 인수해 SUV 전기자동차 전문회사로 탈바꿈해 한국판 테슬라로 거듭나면 어떨까싶다. 국내 자동차 시장에서 일어나는 현대차의 독주와 횡포. 짜증난다.,2020.12.22
1341291772022935553,𝙳𝙳𝚄𝙱𝙱✨,아빠가 테슬라 운전시켜줌 깔깔 너무좋아~!,2020.12.22
1341287062696153089,Hal Magice,(테슬라 이빨이 번쩍),2020.12.22
1341281668083007489,한국경제신문,"올해 해외에서 주식을 순매수한 개인 투자자들이 자녀에게 물려주고 싶은 해외주식은 무엇일까요. 설문 결과 애플이 1위, 테슬라는 2위를 차지했습니다.https://t.co/kEYtgF9k3H",2020.12.22
1341279312469610496,TeslaZoa,"Wedbush의 이번 목표주가 상향 내용($715) 중 '2025년 전기차 공급의 40%를 테슬라가 한다'라는 예측이 있습니다.올해 상반기 plug-in 점유율은 19%입니다.그러면, 세계 시총 1위 애플의 스마트폰 점유율은 얼마나 될까요? 올해 3Q 11% 입니다.생각하면 할수록, 테슬라는 최고 기업입니다. https://t.co/uC7oAmEydF",2020.12.22
1341275785005568005,스넥(SNEK) - 경제를 더 재밌게,"테슬라 대박 투자가, 캐시 우드(Cathie Wood) 종합 인터뷰 https://t.co/bacNTkNC82",2020.12.22
1341274970551291904,🇰🇷 최종완(Brian Choi),"노르웨이에서 테슬라가 잘 안 팔린다는 테슬라 비관론자들의 공격 포인트가 무너지고 있네요.다시 판매량이 치고 올라오고 있는데 아마도 추운 나라인 것을 고려하면 모델3에 히트펌프가 적용됭니 겨울철 주행거리가 늘어난 효과가 아닐까 싶습니다.",2020.12.22
1341272256463290369,연합뉴스TV,"""애플, 2024년 자율주행 전기차 생산""…테슬라 주가 급락https://t.co/Z93TJBnF5l",2020.12.22
1341271868574068743,한경 KVINA,"바이오엔테크 ""변종에도 백신효과 확신""..테슬라, S&amp;P500 편입 첫날 6% 급락..[글로벌 뉴스]https://t.co/diHGDBgtBn#바이오엔테크 #백신 #테슬라 #화웨이 #급락 #글로벌 #뉴스 https://t.co/YzNTwMKNcy",2020.12.22
1341271075057848320,이ㄹ파ㄹ,테슬라vs애플카 ㅋㅋㅋㅋㅋㅋㅋㅋㅋ,2020.12.22
1341268834129309697,DDiDDi,"4. 테슬라가 갖춘 전기차 생태계(제조, 보험, 스타링크, ESS)는 애플이 쉽사리 진출할 수 없거니와,  몇 개는 진입도 못 함. 5. 즉 원가절감이 안 됨. 애플이라도 비싸면 살까?결국 시제품이 나와야 뭐라도 알 수 있음;;또한 편입일에 이런 루머가 나오는 것은 세일 기회.",2020.12.22
1341268832908808198,DDiDDi,"애플카는 아직 먼 나라 얘기.1. 2024년은 아직 먼나라얘기. 그래도 분명 준비하곤 있는듯.2. 주행거리 등의 순수 자동차 성능은 제조업체에 따라 같은 배터리를 쓰더라도 다름. 아직 아무도 테슬라를 따라 오지 못 함. 3. SW 경쟁력이 있는지도 모름. 글치만 기존 애플 제품에서 SW경쟁력은 굿.",2020.12.22
1341265700774531072,다미5880,"실시간바카라 데일리룩추천 슬롯머신사이트추천 블랙잭사이트 고양이스타그램 주식투자게임 골프중독 뷰티인플루언서 테슬라 가족여행  출장만남 출장마사지 출장샵  zhIHLije4wlShttps://t.co/NUJF9id4wb",2020.12.22
1341262225948856320,한국일보,국내 투자자들이 자녀에게 물려주고 싶은 해외주식으로 테슬라와 애플을 꼽았습니다. https://t.co/QFCr5P87jg,2020.12.22
1341258728780152832,이기니,"기관투자자의 단점이 확연히 드러나는 것이 테슬라가 S&amp;P 500에 편입사건.  워낙 ETF들이 규모가 커서 개별 투자자의 리스크는 그리 크지 않겠지만, 아무리 봐도 버블주인데 펀드에 기계적으로 편입함.  피터 린치가 말한 개인투자자가 기관보다 유리한 면을 보여줌.",2020.12.22
1341256127195930625,레이어드,"테슬라 공매도 현황 (잔량, fee, 전환사채) https://t.co/67QVQtnd6G",2020.12.22
1341253130827120640,🕊입동에 핀 차꽃,"사상최고 테슬라몰빵 서학개미 함박웃음https://t.co/fInU69tZDx●S&amp;P성공적 편입●서학개미 보유액 77억불 1위 테슬라, 올해 8배 상승●한국투자자의 테슬라평균매수단가→ $284.8,평균수익률 →144%●애플은 $100.6→25.8%아마존 $2,729.8→17.3%엔비디아 $432.3→22.8%마소 $186.7→17% https://t.co/JAUHg8hV1e",2020.12.22
1341252288174649344,99gnos77,부럽다는 감정도 들지 않고.. 더욱이 2015년 테슬라 주가 알아보고 싶지도 않고.. 그저 피눈물만 나네요..,2020.12.22
1341251775177736192,99gnos77,테슬라 모터스 읽기 시작. 서문 읽는 것만으로도 테슬라 사고싶게 만드네.,2020.12.22
1341251466757980161,지디넷코리아,"S&amp;P 500 데뷔한 테슬라, '애플 전기차' 소식에 흔들 https://t.co/M5FIcDtP33 https://t.co/XHY5SqZbKU",2020.12.22
1341248652421988352,무늬,결국 테슬라의 경쟁자는 애플이었던 것... 나머지 자동차 제조 기업들은 하드웨어를 제공하고 데이터는 애플이 가져갈 듯,2020.12.22
1341247553703067648,꼬.,퐁이 주사날이라 강제휴가외출 ㅠㅠ 펫미업 처음 이용해보는데 좋은기사님이면 좋겠다. 무려 테슬라라구,2020.12.22
1341243081509617665,BAIK GICHANG,"#자율주행 #애플 #테슬라---21년도에 가장 핫한 테마가 될 가능성이 높다. 원래 전기차와 자율주행차는 같이 가는 흐름이다. #켐트로닉스 #텔레칩스 등등https://t.co/e6DsoWgZxy",2020.12.22
1341242085060440066,위키트리 WIKITREE,자녀에게 주식을 물려주는 것이 유행이 됐습니다 https://t.co/XOYDIJeyKJ #해외주식 #테슬라 #애플,2020.12.22
1341233178657230852,후드리,하. . . 일론머스크때문에 테슬라 정이 잘 안 가,2020.12.22
1341232664901079041,@ukn_iluvu@k.lapy.link,카지랑 테슬라랑 피닉이랑 아슈랑 헬가랑... 허엉 시비르 선생님 있으면 더 좋아 학교 친구들 다 모여서 파티 했음 좋겠군 카지가 네바리도 불러와서 네바리 사실 초대 받아서 기쁜데 어정쩡하게 굳어서 반응 못 하다가 정 니가 그렇게까지 말한다면 간다&lt;는 뭔가 평범한듯 아닌듯한 대답하기(??,2020.12.22
1341226227969843201,eagle,테슬라 S&amp;P500 편입 첫 날 6.5% 급락… 산타랠리 없었다 https://t.co/9Qk8YSrPsO,2020.12.22
1341222538437771265,eagle,"[영상] 포르쉐 vs 테슬라, 고급 전기차 둘 다 타본 느낌은? https://t.co/ahpwWhsI3P",2020.12.22
1341219628635353088,블로터,애플 VS 테슬라…자율주행차 ‘스타워즈’ 벌어지나 https://t.co/ReWAwpTyVp,2020.12.22
1341218304501792769,레이어드,"파괴적 혁신기업 현재 주가 기록 (20년 12월 22일)- 테슬라 : 649.86- 아마존 : 3,206.18- 쇼피파이 : 1,197.26- 페이팔 : 232.72- 스퀘어 : 233.50",2020.12.22
1341215211248709635,레이어드,"테슬라 관련 이슈들 정리 (S&amp;P500, 애플카, 목표주가 상향) https://t.co/SCXKhXwap1",2020.12.22
1341211605929889800,투자/주식의 생활화 퇴직 오과장,"Resilience (복원력)어제 시장의 흐름을 한 마디로 표현하면, 복원력이 될 것 같네요. 어제 WISE를 통해서 말씀드렸던 조정 요인인 1)Sell on NEWS, 2)원화 약세, 3)테슬라 이슈 등에 더해서 변종코로나 이야기가 나왔고, 브렉시트 우려가 나오면서 유럽 증시 및 유가가 크게 흔드리는 모습을",2020.12.22
1341205180763664384,ForceArcher,"You should buy all the EV battery, lidar, and EV enhancements $SPACs because one day, one of them is going to work with $APPLDO NOT TRADE $SPAC OWN IT!$TSLA $SPAC $JKS $NNOX $BTC $ETH $AAPL #테슬라 #애플 $ACB $NIO $SBE $SNOW $FROG $U $NIO $BA $BABA $ZM $UBER $CIIC $THCB $QELL",2020.12.22
1341198660617424897,eggry,@isotoxin390 @dhunter_tw @_clearest_blue 북미 교외면 차고에서라도 충전하지 한국은 아파트랑 직장에 없으면 테슬라 뿐만 아니라 그냥 전기차는 왠만한 근성으론 못 탐,2020.12.22
1341198503662346240,NewYorker,테슬라...모델 3 사고 싶었는데 조립 품질이라든지 AS 문제 등등 진짜 쓰레기네 이거,2020.12.22
1341198417687621633,KJ,@eggry @dhunter_tw @_clearest_blue 마이갓~ 제 동생이 왜 한 때 테슬라 빠였나 싶었는데 전에 다니던 직장에 EV 충전 스테이션이 있었군요 참,2020.12.22
1341197853369221120,KJ,@eggry @dhunter_tw @_clearest_blue 제 동생도 연봉 꽤 되는 골수 테슬라/머스크빠였는데 정부 환경 보조금 종료되니까 바로 짜게 식어서 안 산다고 했슴돠,2020.12.22
1341197048545116160,eggry,@dhunter_tw @isotoxin390 @_clearest_blue 아이폰 사는 사람이 보기엔 마감이 너무 구려! 사실 차 별로 안 타서 일단 그정도 가격이면 벤츠든 테슬라든 아까워서요.,2020.12.22
1341196872183005185,daba,@isotoxin390 @eggry @_clearest_blue 사실 차도 좋아하시고 애플도 좋아하시는데 테슬라는 안 사는 드문 분이라 좀 의외라는 생각은 늘 하고 있습니다. 제 트위터 타임라인의 아이폰 산 사람들은 다 테슬라 있어서...,2020.12.22
1341194906975526912,KJ,@eggry @dhunter_tw @_clearest_blue 그리고 그 꺼지는게... 테슬라 안전 위협 요인 중 하나기도 하고요.,2020.12.22
1341194839518445570,eggry,@isotoxin390 @dhunter_tw @_clearest_blue 테슬라가 충돌안전은 최고 등급인데. 불만 안 나면…,2020.12.22
1341194691153412096,KJ,@eggry @dhunter_tw @_clearest_blue 오우 테슬라와 패리티래도 안전은 기대 안해요.,2020.12.22
