id,user_name,text,write_date
1314007129783590912,🇰🇷 최종완(Brian Choi),"뉴스트리트 리서치, 테슬라 목표주가 578불로 상향Bull case에는 1200불도 가능하다고!",2020.10.08
1314007093070843904,이코노믹리뷰,"[2020 국감] 현대차·테슬라 경영진, 8일 국감 대거 출석https://t.co/fjh0FG16qT https://t.co/mKANCcXGQ6",2020.10.08
1314006912774537217,이기니,니콜라 테슬라를 꿈꾸는 에디슨 https://t.co/fzgJqXpzA7,2020.10.08
1314006078175100928,スミ🌙,"테빠가 젤 극혐이다테슬라는 인정하지만 앱등이는 주로 감성을 외치며 포교활동을 하지만 테슬라 빠돌이들은 뇌피셜테크놀로지의 개소리를 외치며 포교활동을 함",2020.10.08
1314001659576479745,🇰🇷 최종완(Brian Choi),지인의 테슬라 방문 AS 경험 https://t.co/FGgfznITD0,2020.10.08
1313996426628669440,뉴스하이라이트,"올해 상반기 전기차 보조금 1,279억원 중테슬라 전기차에 552억원(43.2%) 지급 https://t.co/8LRkHUhTG9",2020.10.08
1313991053645549569,절제주식투자연구소,"유비벨록스, 자율주행 스마트카 소프트웨어 기업. 테슬라 완전자율주행차량 관련 기대https://t.co/SZKktIIvl7#절제주식투자연구소 #절제 #유비벨록스 #스마트카",2020.10.07
1313988964072579072,플래니모,"테슬라, 2020년에만 50만대 생산이라니, 그만큼 다른 엔진 차는 안 팔렸단 얘기네.",2020.10.07
1313986724779839490,지디넷코리아,"머스크 ""올해 테슬라 전기차 50만대 생산 가능"" https://t.co/OQCzwiqmAO https://t.co/d48B2tV1Ih",2020.10.07
1313982936350257152,TBS eFM This Morning,"테슬라의 #배터리데이 를 맞아 CEO #일론머스크 가 발전된 배터리기술로 혁신을 이끌어내겠다는 입장을 밝혔지만 혁신적인 기술이 없었다는 평가와 함께 투자자들을 실망감을 표출했습니다. 미시건대의 Richard Laine 교수님과 자세한 이야기 나눠봤습니다.다시듣기: https://t.co/0wbiLHoWc8",2020.10.07
1313981996612247552,국회의원 윤준병,"[10/7보도자료] 윤준병 의원, 올해 상반기 전기차 보조금 1,279억원 중 테슬라 전기차에 552억원(43.2%) 지급 (출처 : 윤준병의 .. | https://t.co/axGlm7spqE 블로그) https://t.co/qUkNLyymaN",2020.10.07
1313981774578368513,레이어드,"베일리 기포드의 2017년 당시 테슬라에 대한 의견 : 투자에 대한 생각 https://t.co/0EtcrWQDnj",2020.10.07
1313975910140268544,로그뉴스,"머스크 ""올해 테슬라 전기차 50만대 생산 가능""https://t.co/jRsaiXAqb3",2020.10.07
1313916347743576064,Roh chang sup,"'3단 로켓' 올라탄 韓 전기차, 테슬라 겨냥 | 다음 뉴스 https://t.co/Rr7Q1tqhQQ",2020.10.07
1313884366817255424,모건사랑👁캐리사랑💓가오가육체를지배한다☆投資之神⭐전략적으로사고하고뮈췬년처럼행동하는type,"Vermont 는 미국 전기 공급회사구,GMP는 테슬라가 팔고 있는 early adaptor 가정용 정기 배터리 팩이야.덩치가 커서 주택사는 분만  설치 가능할듯.테슬라가ㅡ소유한 태양광 회사는 미국시장에서 2년 전 에 없어지고 현 그냥 테슬라가 직접 운영중.저거 쓰면 전기를 지금보다 싸게쓴다는 리포트.",2020.10.07
1313877538075291650,클리앙,"[강좌] 기타 테슬라 모델3 SR+ 죽어있는 트위터, 필러, 리어 스피커 살리기 #강의, 강좌, 클리앙, 팁 - 앱설치 https://t.co/1QScmlEcdv https://t.co/1dF9MiMsyf",2020.10.07
1313869582021521408,토끼프사,"머스크 트윗이 홍보 다 한다?... 테슬라, 미국 홍보팀 해체 정신나간새끼어차피 주가조작 소리들을까봐입도 제대로 못터는데덕분에 자금 다른 종목으로 다 이탈됨 https://t.co/Ul2Z9uJY2J",2020.10.07
1313868108088578048,토끼프사,"수요 급증 희소금속 등 원료광물 비축전략 ‘시급’ 테슬라는 그래서 관련된리튬회사, 니켈채굴회사랑 계약하고 있음 https://t.co/qPVVQo3YzZ",2020.10.07
1313859521345810433,쿠도군,"테슬라가 미국내 홍보팀을 해체해버린다는 보도가 나왔다.지난번엔 미국 전시장 네트워크를 닫겠다 그래서 말이 많더니만....https://t.co/uZ3ZyB9YnI",2020.10.07
1313858755071705089,Reachy,"[투자] 테슬라 팔아 니콜라 매수…PB센터의 우울한 추석https://t.co/2nNnOpBvfv",2020.10.07
1313857973488218112,우주,아는 사람의 친구가 .. 퇴직금 2천 전부 테슬라에 부엇다가 1억 만들엇다는 소리 듣고 눈물 찔끔 낫음,2020.10.07
1313853950223765505,JJ's view,"테슬라의 주가가 계속 현 수준을 유지한다면, 일론 머스크는 테슬라의 월매출보다 훨씬 큰 보너스를 또 받게 됩니다. 그렇게 되면 일론 머스크가 받는 누적 보너스는 테슬라의 반년치 매출에 육박합니다. 2018년 스탁옵션을 부여할 땐 주가가 이럴 줄 꿈도 못꿨단 의미.",2020.10.07
1313849929240985600,우떵,"좀비가 세상을 뒤덮고, 둘만이 살아남은 곳에서 테슬라은(는) 말했다.""미안해.""""살아줘서 고마워.""나는 실감했다. 세상은 끝났고, 너와 이별할 시간이라고. 너의 손을 잡고 난 눈을 감았다.#shindanmakerhttps://t.co/EvHlXDEsIA캘백씌가고싶어",2020.10.07
1313847967665713152,베터미,테슬라의 일론 머스크는 워렌 버핏을 노렸나 https://t.co/Mg96ALihK5,2020.10.07
1313843321597358080,ㅁㅓㅜ,@huahua__lulu 테슬라,2020.10.07
1313842836714921985,모건사랑👁캐리사랑💓가오가육체를지배한다☆投資之神⭐전략적으로사고하고뮈췬년처럼행동하는type,"테슬라 애플 대장주들은 1퍼센트때 상승 고작.결국 오늘 내수 관련주, 스티뮬러스 첵 1200불 통과 대면 오를 종목들이 가네.그돈으로 여가 즐긴다고 보고.그외 잡주도 좀 가고.테슬라 애플 들어갈 판단이 안선다.조정이면 좋은 기회고 사더라도 완전 쪼끔씩.분할매수.",2020.10.07
1313837939932065800,백신접종증명서발급신청바로가기 (사이트는 프로필GO!),테슬라 주가 전망 추이 https://t.co/OGxfL6s5VD,2020.10.07
1313829321178402817,마술피리,"[2020 국감] 전기차 보조금, 이대로 괜찮나… 테슬라가 43% ˙꿀꺽˙ (출처 : 머니S | 네이버 뉴스) https://t.co/qT4ysi4bIV",2020.10.07
1313829096183357441,마술피리,국감 나오는 테슬라... ＂자율주행 문제 해명하라＂ (출처 : 머니S | 네이버 뉴스) https://t.co/afy3OqdGrr,2020.10.07
1313824025802547200,모건사랑👁캐리사랑💓가오가육체를지배한다☆投資之神⭐전략적으로사고하고뮈췬년처럼행동하는type,태양광판(우주에선 효율이 지구보다 훨 조아)이 있어야우주에서 햇빛받아서 그에너지로 테슬라전기화물차로 달.화성 왔다갔다하면서코발트 막 엄청매장데인는거 독점으로 막파야지.코로나인지금 미국빼고 인공위성 미친듯이쏠수인는 자금 인는나라 업짜나.다들IMF직전인데 우린 지금 돈많아서우주개발,2020.10.07
1313817951259160576,공삼,흐름 끊기는거 없이 질문 이어나가는거 미쳣다 ..리액션에도 빈틈이 없네요 최민기 진행 테슬라전기차보다 완벽하다,2020.10.07
1313812072061435906,Wan Ki Choi,"- 세계 최고 부자 아마존 CEO 제프 베조스의 재산은 1830억 달러로 1년 전 대비 680억 달러가 증가해- 10월 7일 현재 마이크로소프트 공동설립자 빌 게이츠의 재산은 1230억 달러, 테슬라 CEO 일론 머스크는 1010억 달러, 페이스북 CEO 마크 저커버그는 981억 달러로 나타나",2020.10.07
1313806713472970752,릴로,테슬라공 트윗 생각남 https://t.co/HhfFh5Iq9l,2020.10.07
1313801940753616896,트잉여,테슬라의 충전시 화재 상황 대응 - https://t.co/Buk4AVIiNx,2020.10.07
1313774805666066438,김티끌,테슬라 겁나 떨어졌구나,2020.10.07
1313771092926959616,허프포스트코리아,"""자율주행 차량에 대한 경찰의 단속 근거가 없다""는 이유로 테슬라코리아 김경호 대표가 경찰청 국정감사 증인으로 채택됐다 https://t.co/JZeSfGGpTB https://t.co/jAhZM0DZvb",2020.10.07
1313769220027543552,MotorFactKorea,"테슬라 모델Y, 스탠다드 모델 단종 후 새로운 배터리로 다시 부활?자세한 기사내용은 프로필 링크를 클릭해 주세요#테슬라 #테슬라전기차 #수입SUV #전기차그램 #순수전기차 #모델Y #테슬라모델Y #자동차리뷰 #자동차뉴스 #중립적인자동차뉴스모터팩트https://t.co/hG00deNry5",2020.10.07
1313754062672678913,모터매거진motor_magazine,"1위 탈환한 벤츠, 수입차 판매량 꾸준한 증가세 보여 #KAIDA #수입차판매량 #메르세데스벤츠 #BMW #폭스바겐 #테슬라 #E클래스 #5시리즈 https://t.co/5fM5ggPUaP https://t.co/PcAXP86wph",2020.10.07
1313747616199393280,rev,"미주하는 사람들 진짜 애플, 테슬라는 다들 가지고 있는 거 같음",2020.10.07
1313743550366904320,위키트리 WIKITREE,역대급이라고 할 수 있을 정도로 충격적인 결합 아닌가요? https://t.co/nBF8OvYvlK #테슬라 #테슬라지붕 #테슬라Y,2020.10.07
1313743262667042817,Kiriranshero,"https://t.co/P0i466rmvy이렇게 또 테슬라 홍보를 해주고...",2020.10.07
1313736370750275586,♦️⭐️🌙💙페라,아직도 가끔씩 속이 쓰리는데 나 테슬라 뽑으려고 60만원 추가로 12만원 썼거든요 이보쇼이보쇼...,2020.10.07
1313727854543163392,dolgorae,내년 관심사는 단연코 테슬라일듯,2020.10.07
1313725983443177472,빠-ㅇ🍞,"대충 얘네둘은 떨어질일이 없는것같은데... amd는 zen3 잘나오면 오를거고 빅나비 안좋으면 좀 떨어지기야 하겠지만... 마소는 뭘해도 그냥 천천히 오르고있는듯테슬라는 꽁으로 2천원어치 준건데 회복이 안되는중ㅋㅋㅋㅋ https://t.co/ENiaOjHnHB",2020.10.07
1313722905553850369,이포커스,"韓 전기차 시장 휩쓰는 테슬라...9월 수입차 판매 4위#테슬라 #테슬라모델3 #테슬라전기차 #테슬라판매량 #모델3 #전기차 #전기차판매순위 #전기차판매량 #전기자동차 #수입차판매순위https://t.co/YPHMWQmwAJ",2020.10.07
1313720951683514370,선대인경제연구소,"경제이슈해설&lt;배터리데이, 테슬라는 무엇을 보여주었는가&gt;업데이트되었습니다. 테슬라 배터리데이에서 당장 내놓은 혁신 기술이나 신제품이 없다고 해서 배터리데이의 내용을 평가절하해서는 안 된다.  '문제의식의 크기가 혁신의 크기'임을 보여준 행사였다. https://t.co/DuiR6zc96r",2020.10.07
1313717620420431872,기자 김필재,비운의 천재 과학자 '니콜라 테슬라' 이야기 https://t.co/qQr9fWuI6L 출처 @YouTube,2020.10.07
1313709098781736962,이코노믹리뷰,"[2020 국감] 테슬라 잘난게 죄…“고가 전기차 보조금 감축·제한해야”https://t.co/bjCEGzzyGV https://t.co/FJjaDQtdd0",2020.10.07
1313700259323736064,백탄(07,테슬라 5단까지는 맞추고 리아는 얻고나서 시작해야겠네.. 그치만 리아한테도 도움이 되긴 한단 말이지,2020.10.07
1313691323501690880,뜸한 버버🐺,헬가 코스튬하나만 더내줘 듣고있냐 림봉아... 단독루트같은거..안바란다 마.. 우류&amp;헬가 고아원루트라던가... 카지쥬꾸알드리치등등과 함께하는 고딩조라던가... 하다못해 우류테슬라오로시아크루노랑 함께하는 북유럽신화 기반 신기사 라그나로크 루트를 주던가,2020.10.07
1313679951573454848,J,상위 20위권 안에는 당연하겠지만 테슬라를 시작으로 고가 브랜드는 다 없기는 했음.. 놀랍기도 하지만 수익성이 좋은 모델하고 많이 판매되는 모델이 다른건 주목할만한,2020.10.07
1313679364500852736,장순호,"테슬라 모델3 가장 저렴한 곳 https://t.co/AsdluVMAXi",2020.10.07
1313666372442808320,yysnewspick,"김종민 ""13년째 주식 투자.. 테슬라 쇼크에 출혈""https://t.co/eGmXfpPOiX",2020.10.07
1313648861756481536,져스틴 이버,@brianchoi_tesla 테슬라는 부동의 1위죠!,2020.10.07
1313646974030155776,나이츠크로니클 카피페 봇,"데미안: 쉬고 싶은데 잠이 오질 않아…싱클레어: 그…양이라도 세 보면 어때.데미안: 그런 게 될 리가…싱클레어: 그럼 어떡해?데미안: 어쩔 수 없지, 테슬라테슬라: …양자전자역학에서 전자가 가상광자를 방출하여 다시 흡수하는 과정은 전자가…싱클레어: 큭… 졸음이, 밀려온다…!",2020.10.07
1313641667845472256,절제주식투자연구소,"테슬라는 실제 생산이 주가를 받쳐주지 못한다! 고로 고평가!https://t.co/gBcKbfC748#절제주식투자연구소 #절제 #테슬라",2020.10.07
1313637380163690497,Bill the Lizard 🦎,"이제는 전기차의 시대구나. #전기차 #2차전지 #배터리 '3단 로켓' 올라탄 韓 전기차, 테슬라 겨냥 | 다음뉴스 https://t.co/Ml5IJnYUGT",2020.10.07
1313634661940117506,yysnewspick,"머스크 트윗만으로 충분?…""테슬라, 미국 홍보팀 해체""https://t.co/vFb8IqyklA",2020.10.07
1313631644507541504,omwnews,"‘NEW 개미’ 김종민, 망투자 고백…“테슬라 쇼크로 출혈”https://t.co/Fsa9C4hyPs",2020.10.07
1313630763703623680,Seongjin Kang,"전기차 산업 발전 추구 인도네시아 ""테슬라와 투자 논의""https://t.co/vIKxWo9SOJ",2020.10.07
1313617744693084161,ForceArcher,"If you are a stock trader follow and turn on notification 👇🏻👇🏻@realDonaldTrump This is the man available to turn +200 Dow Jones index into -300 in seconds by only one tweet.$TSLA $KCAC $SPAC $INO $NNOX $XRP $ETH $FMCI $SPAQ $LCA $NKLA $AAPL #테슬라 #애플 $NVAX $NIO $SBE",2020.10.06
1313615032022786048,GeekNews,"Qt 6.0 알파 릴리즈 https://t.co/DCdIPkVwRJ 대표적인 C++ GUI 프레임워크인 Qt 6.0 알파 버전이 릴리즈Qt는 최근 자동차 회사들(테슬라, 푸조, 메르세데스벤츠)과 스마트TV(LG WebOS, Sky TV) 에 널리 쓰이고 있으며, 상장까지 된 회사Qt 6에서의 변경점:- Windows ARM과 MacOS ARM 타깃 ...",2020.10.06
1313592958260703232,ForceArcher,"I swear he will changed his tone before end of this week.Otherwise, he have no chance to win this election.Just another opportunity to buy the dip.$TSLA $KCAC $SPAC $INO $NNOX $XRP $ETH $FMCI $SPAQ $LCA $NKLA $AAPL #테슬라 #애플 $NVAX $NIO $SBE $SNOW $FROG $U https://t.co/YyPeytR40f",2020.10.06
1313591448097312768,교주(늦깎이유학),카지 니유 우윈 바쿠라 샤슈 세츠 가리에 우류 웬시 호체 안 더그 슌 뮤아 베라 아라시 와타리 테슬라 레오스 에루비 라게츠 웨이디 종야오 시리 헨코 미사키 오로시아 세레스 플로라 달비라 로나크 안화 유우토 사하무 렉터 루안유 루안옌 토쿄쿄 크루노 아슈 도도 #생각나는신기사다말하기챌린지,2020.10.06
1313584827652734976,TJ,"""저는 그냥 월스트리트화 되었다고 생각해요. 미국은 한국과 비교가 안 될 정도로 대박과 돈을 좇는 나라죠. 승자독식도 엄청나고요."" 테슬라 10따상인 지금은..https://t.co/VrA7EWPHsd",2020.10.06
1313581525913333761,모건사랑👁캐리사랑💓가오가육체를지배한다☆投資之神⭐전략적으로사고하고뮈췬년처럼행동하는type,앞으로 대중교통 유리병 회사 보험 원유 회사들은 사양산업 이니까.단기만 하도록 해 ~테슬라는 조정시마다 1주씩 사야데 태양광이랑 전기화물차 우주에서 필요한 핵심재료라 이라 10년 ...계속 쭉쭉 .비밀인데 화성이랑 달에 코발트(2차전지) 겁나 만어.그거 때는 이때다 독점 해야지 우리만 개발하기,2020.10.06
1313570662305296384,나무와 꼬무,@artcraft71 돈이 어딨어서 아마존님을 두개 씩이나... 테슬라,2020.10.06
1313570279482777600,나무와 꼬무,@artcraft71 @zigolleid 떨어지는거 보고 테슬라 2개 주웠는데.. 내일 어쩔라나,2020.10.06
1313559641218056192,jk,테슬라 모델3 1열 안전벨트 컬러안전벨트 교체작업 (출처 : JK튜닝 | https://t.co/ZlO0IsusOf 블로그) https://t.co/tjs8R1uyTw,2020.10.06
1313539972390027265,오스바OSBA(프로필 연락처),"진짜 자야된다...제 최애에피는에클닥 첫화랑 기나긴게임테닥 도서관이랑 좌회전맷닥 섹시랑 드림로드랑 50주년이랑 빅레드프렌들리버튼카닥 옥시겐빳따휘닥 로자랑 솔리트랙트 테슬라",2020.10.06
1313531526970130432,유언 봇,"새로운 세상에서는 지식과 과학, 예술의 산물이 개인의 부를 위해서가 아니라 인류의 복지와 윤택한 삶을 위해 쓰일 것입니다. - 니콜라 테슬라 (1856.7.9~1943.1.7)",2020.10.06
1313503385547612161,김유연타케모토아야카코사카나오모리타히카루아라이아야카손혜주외침봇,"[나의 트윗정체성]그거,노래,그룹,혜주,몰래,오빠,누나,기타,여자친구,love,플레이인,10월,내사랑,조유리,시드,원래,있음,존나,오세요,요즘,부럽다,튀김,아마,사실,평생,나와서,모름,테슬라,이달소,경기 https://t.co/XlZcJ6QBrp",2020.10.06
1313502762143891461,simsimgada,"단언컨대 테슬라 그 이상의 돌풍, 미리 알아두면 무조건 성공하는 역대급 미친 기술 BCI (보면 손해볼 일 없을 겁니다) https://t.co/r61QKigSye 출처 @YouTube",2020.10.06
1313501414912454658,envestor,테슬라 '배터리 데이' 별 것 없었다?…우리가 놓친 것들 https://t.co/EYVA8bTs8G,2020.10.06
1313500353938116608,서림,하긴그래도 브뢴스테드랑 로우리보다는 테슬라에대해 잘 알듯ㅋㅋ,2020.10.06
1313500201856901125,서림,나는 ㅅ테슬라에 대해 잘 모르는구나.. 하고 생각해보니까 원래 과학에 나오는 사람들에대해 잘 모르는게정상이지?,2020.10.06
1313491171075862532,ForceArcher,"Some people worried about RSNA not listing $NNOX but here you go 👇🏻👇🏻👇🏻👇🏻👇🏻$TSLA $KCAC $SPAC $INO $NNOX $XRP $ETH $FMCI $SPAQ $LCA $NKLA $AAPL #테슬라 #애플 $NVAX $NIO $SBE $SNOW $FROG $U",2020.10.06
1313488872999976963,🇰🇷 최종완(Brian Choi),"중국에서 만든 모델Y를 12월부터 유럽으로 수출한다는 설이 있네요!속도전의 테슬라!",2020.10.06
1313487705662279689,온,"엔비디아로 수익이 나기 시작했다. 고변동성의 나녹스, 엔비디아, 테슬라... 상황판단하고 선택하는 수많은 기회들. 존버의 셀트리온2형제.. 등등 자존감이 주식하고 높아져서 많이편안해졌다.",2020.10.06
1313485138643357697,데이빗 보위,(크리스토퍼 놀란이 보위를 섭외하려고 했을 때) 내가 상상했던 테슬라의 이미지는 당신뿐이며 당신이 있어야 관객들이 영화를 수긍할 수 있다.,2020.10.06
1313482443261960193,@segfault87@uri.life,https://t.co/VcnkGrXbFF 테슬라 GitHub에 Qt fork가 있네... 테슬라 UI가 Qt 기반인가?,2020.10.06
1313465751303385090,return P,테슬라 비켜! 조선의 사이버트럭 봉슬라? 전기차 봉고3 EV를 뽑았습니다. (feat. 뽑자마자 문제가...) https://t.co/M9wGZKbMv1 출처 @YouTube,2020.10.06
1313464366692364294,Kiriranshero,@listege 테슬라도 오파 켜놓고 자지만 않으면 안전한거 같습니다 ㅋㅋ,2020.10.06
1313463106782195712,Kiriranshero,@listege 볼보도 뭐 비슷하게 오래 걸리지 않습니까? 테슬라 환불도 해주니까 일단 지르고 보는겁니다 ㅋㅋ,2020.10.06
1313462972879044610,Jaewon Yoo,@Kiriranshero 아니... 테슬라는 좀 더 보고 ㅋㅋㅋ 저는 볼보 쪽을 좀 고려하고 있습니다,2020.10.06
1313460390127300608,작살🏴‍☠️,테슬라 비켜! 조선의 사이버트럭 봉슬라? 전기차 봉고3 EV를 뽑았습니다. (feat. 뽑자마자 문제가...) https://t.co/ByCyMLTwHu - @YouTube,2020.10.06
1313445998018981888,SCP-BOT,"SCP-2700ㅣ안전ㅣ텔레포스ㅣ니콜라 테슬라에 의해 개발된 고성능의 지향성 에너지 무기로 추정됩니다. 3개의 구성 요소로 이루어져 있으며 조작판, 가속기, 코어로 구성됩니다.",2020.10.06
1313444378548019202,🕊입동에 핀 차꽃,"일론 머스크. 유럽이 오염 (내연기관 자동차)에 보조금 주는 것을 미쳤다고 비판.○테슬라 독일서 차량 인도 24% 증가.○7월엔 캘리포니아 Palo Alto에선 테슬라 모델Y를 월 499달러에 리스하는 옵션 도입..https://t.co/kBpNg7wvdm",2020.10.06
1313431696411246592,Mr. Positive.,"사람들이 테슬라를 일반 기업으로 생각하면 이해하기 어렵다. 점점 더 저렴하게 차를 팔고, 환경을 보존하며 광물을 캐고, 물을 절약하며 공장을 짓는 등. 이익에 반하는 기업 활동을 한다. 역설 적이게도 그렇기에 성공할 수 있다.",2020.10.06
1313430086561849344,Mr. Positive.,@ElectrekCo @brianchoi_tesla @FredericLambert 조만간 미국 공공기관의 자동차는 테슬라로 바뀌겠네요.. 추가 공장들이 생산을 시작하면 어떨지 벌써 기대됩니다. ~!!,2020.10.06
1313426918134312962,ddj7122227,테슬라 모델3 프런트패키지PPF 시공 - 대구RAD https://t.co/0mcQsVpBop,2020.10.06
1313424055924473856,시후티비,"SK렌터카 테슬라만의 빠른 출고를 경험하세요! (출처 : 시후티비님.. | 블로그) #SK렌터카 #테슬라SK렌터카 #SK렌터카테슬라 #전기차선착순 #즉시출고#모델3https://t.co/FS8KoVlVxn",2020.10.06
1313421735597764608,토끼프사,"[글로벌-Biz 24] 테슬라, 인도네시아에서 니켈 채굴 추진 https://t.co/o2I27wFBCm",2020.10.06
1313421551023222786,토끼프사,"'반값 전기차' 준비 테슬라, 파산 직전 배터리회사 쓸어 담는다 - 머니투데이 https://t.co/XKllHg2dR1",2020.10.06
1313420433450885123,ForceArcher,"$RMG merger with Romeo Power, a lithium-ion battery company for commercial EVs.1. Founded by former $TSLA and SpaceX engineer 2. This deal make the company value at only 1.3B$KCAC $SPAC $INO $NNOX $XRP $ETH $FMCI $SPAQ $LCA $NKLA $AAPL #테슬라 #애플 $NVAX $NIO $SBE $SNOW https://t.co/ntE1ksjuST",2020.10.06
1313413048598622210,경선 수개표!투표소 수개표!,"@Jaemyung_Lee 영국 '가디언지'는 기본소득에 대한 열정을 지닌 이재명 지사를 '기본소득 4대 주창자'로 꼽았다. 가디언지가 선정한 기본소득 세계 4대 주창자는 이재명 지사를 비롯한 일론 머스크(테슬라모터스 CEO), 로버트 라이시 (전 미국 노동부장관), 브누아 아몽(프랑스 대통령 후보)분들과 몇년전부터",2020.10.06
1313409215835238400,Bosco,@xfile_lol_ 나중에 혹시라도 합병하면 &lt;니콜라 테슬라&gt; 되겠네요 😅,2020.10.06
1313406286038409216,Montani semper liberi,중국산 테슬라 모델3는 괜찮은 거냐...,2020.10.06
1313404617867186178,장순호,테슬라 모델3 렌트비용 스타캠핑카 https://t.co/ouy5aWe5hK,2020.10.06
1313403206819475456,M4A5G3E1N4T5A (LG Twins 우승),달리기 전의 테슬라인가 https://t.co/4wRK4oKuXa,2020.10.06
1313402707026219009,MotorFactKorea,"테슬라의 떠오르는 라이벌, 루시드모터스 첫 전시장 내부는?자세한 기사내용은 링크를 클릭해 주세요#Lucid #Tesla #루시드에어 #순수전기차 #차량비교 #테슬라 #테슬라그램 #자동차리뷰 #자동차뉴스 #중립적인자동차뉴스모터팩트https://t.co/g7oYutCSXs",2020.10.06
1313401487016431618,WhBearer,일론 머스크 꿈 Zip2 페이팔 스페이스엑스 테슬라 하이퍼루프 스타링크 https://t.co/CVmE6IikFi,2020.10.06
1313400331590492160,우떵,테슬라 아니고 슬라인거 너무웃김,2020.10.06
1313393141056114694,미니풀🎗,@WR_09 안그래도 항공은 장투 생각하고 들어간거긴해여 ㅋㅋㅋㅋㅋ 해투 얼마전까진 좋다가 요번에 테슬라에서 말아먹는중 ㅋㅋㅋㅋ,2020.10.06
1313390558400847873,yysnewspick,"전기차 산업 발전 추구 인도네시아 ""테슬라와 투자 논의""https://t.co/YXRWNdSDBj",2020.10.06
1313390009861369856,이세호,테슬라 컨버터형 ㅋㄲㅋㅋㅋㅋ,2020.10.06
1313388847175139340,dream,테슬라 모델3 렌트비용 저렴하게 하려면? (출처 : eun1004hye.. | 블로그) https://t.co/m0K5wRQSqh,2020.10.06
1313383211532132352,희망존버술사,"테슬라 차로 이만큼 죽었으면 더 큰 난리가 났을텐데 하는 생각이 든다. 혼다 에어백 또 '펑'..美 17번째 사망  https://t.co/wY8F4ETASQ",2020.10.06
1313381821489451010,디랙델타함수,이자크 왕관 ㅋㅋㅋ 팔에 걸고 다닌다길래 아니 왜 그걸 팔에 걸고다녀... 하긴 원래 후드 쓰고 다니는 애니까 그러려니 했는데 알고보니 이자크는 양반이었다 테슬라 참치 스샷 보고 뒤집어짐,2020.10.06
1313370211874078720,₩9,"[글로벌-Biz 24] 테슬라 '모델 Y'가 '오픈카'로 변신한 황당 사연https://t.co/Mr30YRfVrL",2020.10.06
1313370142252752896,NOT DiGITAL,RT) 테슬라 Y 샀더니 천장 루프 날아감.(...),2020.10.06
1313369907690573825,₩9,테슬라 모델 Y를 샀는데 천장 루프가 날아갔다고ㅋㅋㅋㅋㅋㅋㅋㅋㅋ,2020.10.06
1313357069332877314,*슽컬리*,니콜라 테슬라는 사후에 본인 이름 낱개로 쪼개서 이 난리가 날줄 알았을까.,2020.10.06
1313350065642065922,ㅎㅈㅇ,@gcsgoawpgosuu 800이면 나같으면 테슬라 주식을사놓을듯,2020.10.06
1313324371063173121,𝑺𝑷𝑯𝑬𝑹𝑬,역시 테슬라 ㅋㅋㅋ 안속네 ㅋㅋ https://t.co/zU8De89jgt,2020.10.06
1313317382362861569,Cygnus X-3 pulsar,테슬라와 하슬라는 무슨 관계냐?,2020.10.06
