id,user_name,text,write_date
1338076050530549763,"Macro X (Stock, Coin & Futures)",미국증시 자동차주...테슬라 · 니콜라 · 니오 '급락' https://t.co/PZcsSsNvTs,2020.12.13
1338067363149713409,모건사랑👁캐리사랑💓가오가육체를지배한다☆投資之神⭐전략적으로사고하고뮈췬년처럼행동하는type,US airforce 와 테슬라,2020.12.13
1338064755093766147,민초냉밥,"테슬라 내비 티맵으로 바꼈다던데이렇게 확 바뀔 수 있는건가 ㅋㅋ",2020.12.13
1338064592950370305,민중봉기가 답이다 !,‘전기차 대세’라굽쇼? 테슬라 겨울엔 서울서 대구도 못 감 https://t.co/VoxQvcLt0u,2020.12.13
1338061230267764736,조선일보,"오는 18일 미국 증시가 거래를 마치는 시간, 전세계 자산운용사가 약 700억달러(76조원)에 달하는 테슬라 '매수' 주문을 넣을 예정입니다.https://t.co/DGC6pnHIBf",2020.12.13
1338057414231293957,Zenith.Lee,"잘 읽었습니다^^ 테슬라 15,000불일때분할매도ㄱㄱ^^  🚀 https://t.co/5o0qjZvOdB",2020.12.13
1338053535670288385,노력하는 기획자 윤피디,"테슬라 주가 50% 폭등, 그 뒤엔 ‘거대 ETF의 진격’ (출처 : 아티스트리.. | https://t.co/1dq1sbuz6b 블로그) https://t.co/POi6KZPP3t",2020.12.13
1338050203895525376,문성호 Moon Sung-ho,'전기차 대세'라굽쇼? 테슬라 겨울엔 서울서 대구도 못 감 | 다음자동차 https://t.co/FInYJ0F1Ly,2020.12.13
1338048799105642497,perillamint (mstd: @perillamint@silicon.moe),"모두의 익명 질문을 모집 중!최근 답변한 질문● 뀨 마망…● '빵상 아줌마'에 대해서 들…● ""2020년이면 좀 AES …● 테슬라 같이 구동계를 컴퓨터…#질문상자 #익명질문모집중https://t.co/0KVr7B7vuK",2020.12.13
1338048152998277121,노력하는 기획자 윤피디,"˙테슬라 독주˙ 수입 전기차, 내년 獨 3사 가세 ˙진검승부˙ (출처 : 아티스트리.. | https://t.co/ivlhRfRuuJ 블로그) https://t.co/3pbMC6sfyY",2020.12.13
1338048039869550592,Hal Magice,테슬라 완전 살인귀던데; 애가 안 그렇게 봤는데 음쩡 살벌하드라고...,2020.12.13
1338039090260799488,투자/주식의 생활화 퇴직 오과장,"우리의 일상이 바뀔때추세적 상승장이 나온다.초연결사회 상승사이클은 매우길다.장기시황~FAANG를 넘어서는 성장주는 계속나온다그래도너무 비싸지않나나스닥 32배 테슬라 164배 아마존 53배 https://t.co/Ym52BZlA3L",2020.12.13
1338036197868748800,🎗장단역🎗🇭🇰😷,"'전기차 대세'라굽쇼? 테슬라 겨울엔 서울서 대구도 못 감 | 다음자동차 https://t.co/7hDJ4E6WgL 
13일 환경부에 따르면 테슬라 모델3 롱레인지의 1회 충전 상온 주행거리는 446㎞지만 저온 주행거리는 273㎞다.",2020.12.13
1338032770489073666,야타,이벤트는 가끔 아처 자리에 이슈타르나 테슬라두기도함,2020.12.13
1338032150814228480,un_dense,얼마전 사고난 테슬라에 전기 차단으로 문 안열리는 뉴스보고 예전 로직 카세트데크가 오버랩. 기계식은 뭔가 툭툭 치거나 정안되면 뜯(..)었지만 로직데크는 뭔가 난공불락의 느낌,2020.12.13
1338020338630709249,두번의 봄 | Twice Spring,테슬라코일 양 끝단 사이에 사람을 그냥 세우면 절연파괴 일어나죠? 그게 여럿이면 참 따뜻할거고? 그냥 라이트닝 포스 생각나서 하는 말이에요. 아크소독이란 영역도 있는 것 같던데요.,2020.12.13
1338008683993690113,라샷,사이버펑크 테슬라에서 하네 ㅋㅋㅋㅋㅋㅋㅋㅋ,2020.12.13
1338008638519066625,아프로만,"@kaos10000 여하튼 삼성SDI  전고체 셀은 개발해 놓고도 테슬라가 사용 안하고 건너뛸 위험성 있고,현행 2천번 시리즈 셀과 호환성 높은 4680셀 개발 유력한 LG화학은 테슬라에 합병내지 하청으로 전락할 운명(LG화학이 배터리사업부 분사하려는 기미)   최상위 포식자인  테슬라의 결정에 달려있는 운명",2020.12.13
1338006328313139201,ദ്ദിᐢ. .ᐢ₎,까먹엇다가 방금 생각나서 미니스탁 들어가봣는데 역시 테슬라 고맙다,2020.12.13
1338005566006775809,JJ's view,코스피가 많이 올랐다지만 아직 코스피 상장사 전체의 시장가치는 아직 애플보다 작습니다. 코스닥 상장사 전체의 시장가치는 테슬라의 절반도 안되구요. 개인적인 판단으론 미국 주식들이 비싼 것도 맞고 한국 기업들이 싼 것도 맞는 것 같습니다.,2020.12.13
1338005326965035009,아프로만,"@kaos10000 그 4~5년 뒤에도 양산 불확실한 전고체 셀을 미리가정해서 카트리지 모듈과 플랫폼을 개발하느니, 2천번대 셀과 모듈이 호환되는, 먼저 개발될 리튬이온 4680셀 (전고체 셀과 용량차이가 없음) 기준으로 플랫폼을 주도하고 울궈먹다가 에어리튬 셀로 건너간다는 로드맵이 테슬라 자동차 전략인듯",2020.12.13
1337987667271639040,Hal Magice,(테슬라 이빨이 번쩍),2020.12.13
1337984615613534208,ᐡ. ̫ .ᐡ₎ 당신의 저주인형(버리면돌아옴),"@huibinogi g헐 방송까지 출연했는데다 뽀록이었다고요????????????? 남편이 테슬라 초기 투자자라니까 알 거 같애요 동생이 지나가다 얘기해준 적 있었어요 헐...............",2020.12.13
1337980384668086274,Montani semper liberi,미국에선 2017년 배우 손지창씨가 테슬라 모델X에 대해 급발진 소송을 제기했으나 2019년 취하한 것으로 알려졌다. 미국 도로교통안전국(NHTSA)은 테슬라 급발진 관련 민원이 잇따르자 지난 1월 예비조사에 나서겠다는 방침을 밝히기도 했다. https://t.co/WyrfGHSWca,2020.12.13
1337972767426166784,🇰🇷 최종완(Brian Choi),테슬라 사이버트럭 오토파이럿 하드웨어 테스트 장비로 추정되는..,2020.12.13
1337972280895262721,레이어드,"18일까지 테슬라 주가가 오를지 내릴지 확신을 가지고 이야기하는 것 자체가 사기꾼이다. 아무도 모른다는 것이 상식적인 판단이다. 엄청 긴 흐름을 가지고 이야기하는 것이지, 일주일 후 주가를 어떻게 맞춘다는 말인지 이해가 안간다.",2020.12.13
1337956507158102016,쎄씨루,테슬라 앱을 가끔 들어가 본다. 뭔가 잠자는 숲속의 공주 같고 구하러 가고 싶고 그렇다... 안녕 잘 지내지 내년에 봐... https://t.co/cnclfxzCQI,2020.12.13
1337955404387651587,연합뉴스,"용산 '테슬라 화재 미스터리'…파손 정도가 원인규명 열쇠https://t.co/j6uex47zZi최근 테슬라 승용차가 아파트 주차장 벽을 들이받은 뒤 불이 나 차주가 숨진 사고에서 급발진 의혹이 제기된 가운데 사고 원인이 명확히 규명될지에 관심이 쏠립니다. https://t.co/PMEYTKDgmC",2020.12.13
1337948292081061889,레이어드,"[주간분석] 테슬라, Computer on Wheels 구현한 유일한 회사 (20.12.11) https://t.co/wSawzHMO17",2020.12.13
1337947989390675969,아프로만,"@kaos10000 테슬라 배터리 데이에서 일런 머스크가 공개한 차기 배터리 비전에서 전고체 배터리형 카트리지 모듈은 없음일런 머스크가 노리는 것은 LG화학 카트리지 모듈",2020.12.13
1337946406862999552,Onassis,"머스크의 팔콘로켓이 발사성공후귀환착륙중 폭팔했다엄청난 금액손실,그리고테슬라는가격인하 요원하고차완성도부족 여전A/S 부실등지난10년 테슬라는 번돈으로 뭘했는지 의문? https://t.co/pxSh4TNI7c",2020.12.13
1337945876078100482,아프로만,"@kaos10000 삼성SDI 주력개발하는 전고체 배터리는 양산이 불가하여 테슬라도 가망없다고 패쓰 현재의 2천번대 리튬이온 셀의 차세대는 2023년부터  4천번대 리튬이온 4680원통형 탭리스 셀 - LG화학이 개발유력리튬이온 4680셀이 당분간 주도적이고다음 차세대는 궁극의 에어리튬 셀로 가는 로드맵",2020.12.13
1337942158536413184,corwin1129.bsky.social,"독일 자동차 회사들은 억울할 것 같긴 하다. 100년 이상 내연기관 기술을 쌓아올려서 그 누구도 따라올 수 없는 성벽을 세웠는데, 테슬라 때문에 하루 아침에 이제 그 기술이 lost technology가 될 지경에 이르렀는데...",2020.12.13
1337939496164229120,MBC News (MBC뉴스),"테슬라가 1만 1천 여대를 판매했습니다. https://t.co/MvGvGWWcd3",2020.12.13
1337930279122399233,운동하는 빡🕶️,"10월 : 언니의 새차 구입을 위해 시승하러 다녔고 나는 테슬라가 맘에 들었다. 나도 언니 헌차를 받기로 하고 이것저것 알아보고 다녔다.일도 열심히 했고 미술관도 다녔고 맛있는 것도 먹으러 다녔다. 내게 주는 입학 선물로 애플워치와 아이패드를 샀다. 같은 팀 동료 때문에 골치가 아팠다.",2020.12.13
1337918848570277888,임종,제가 로키를 많이 사랑하죠 비록 테슬라가 정신이 혼미 했지만,2020.12.13
1337918830232793088,======== 안좌동의 쵸림이,테슬라가 생각이 안나서 한챰을 티볼리와 티리온 사이에서 헤맴,2020.12.13
1337918117016571906,D,"얼마전 테슬라 화재사고가 났는데 사망자가 검찰총장 친구인 율촌대표여서 잠시 화제가 됐었다. 그런데 나는 율촌했을때 대번에 최준영이라는 이름부터 떠올랐다ㅋ 지구본 연구소를 봤다는 말인데, 뭐 매일 2 3시간씩 걷는 운동하면서 할게 뭐있나? 유튜브나 듣지ㅋ",2020.12.13
1337916562397745152,Kims,10년뒤 테슬라는?,2020.12.13
1337913175455322113,스펙테이터 인덱스,"시장가치🇯🇵 도요타: 2,110억 달러🇩🇪 폭스바겐: 840억 달러🇩🇪 다임러: 710억 달러🇺🇸 제너럴 모터스: 600억 달러🇩🇪 BMW: 550억 달러🇯🇵 혼다: 500억 달러🇺🇸 포드: 350억 달러🇰🇷 현대: 200억 달러🇯🇵 닛산: 200억 달러🇰🇷 기아: 120억 달러🇺🇸 테슬라: 5,780억 달러",2020.12.13
1337908814499045376,집3✨️륭✨️,테슬라 만세~~~!,2020.12.12
1337901550459645956,스넥(SNEK) - 경제를 더 재밌게,"스페이스 X 와 테슬라의 수장, 일론 머스크 최근 생각 읽기 https://t.co/iVpprgGEAz",2020.12.12
1337900962904592384,러버덕 ,"의문의 테슬라 차량 사고…사망 피해자는 '윤석열 친구' https://t.co/VgkyxcOXOq9일 고급주택단지 주차장 내 차량 사고벽에 충돌 후 화재…1명 사망·2명 부상숨진 차주 판사 출신 대형 로펌 변호사윤석열 검찰총장 친구…고교·대학 동기경위 조사…차체 결함, 과실 등 가능성우연한 사고일까?",2020.12.12
1337895470316699648,단짠(호랑이),어제는 테슬라를 빌려서 놀았다 https://t.co/pBdzmOxy97,2020.12.12
1337867997839413248,여수man,"‘누구말이 맞아?’…JP모건 테슬라 또 매도의견, 골드만삭스는 매수로 유턴 https://t.co/3hZpN2VJS6",2020.12.12
1337862463321067520,.,그리고 엔비디아도 이런 기능이 없는게 아님. Mixed Precision이라고 해서 테슬라 같은 연산 가속 카드나 쿼드로 같은 작업용 카드에는 굉장히 많이 넣은 걸로 암. 지포스 같은 게임용으로는 별 필요 없다고 판단했는지 아주 적게 넣었음 ㅋㅋ,2020.12.12
1337859207744217089,Hal Magice,근방 돌아봤는감? 테슬라 보니까 뭔가 떼를 쓰는 듯한 마음으로 찾아다니면 재수가 좋아지더라고.,2020.12.12
1337839020890415107,임종,"황혼커 썰풀 거리가 있구나 테슬라는 뭐가 없어서 풀것도 없는데 대박이다..",2020.12.12
1337837854349615105,전라도여수남자,"‘누구말이 맞아?’…JP모건 테슬라 또 매도의견, 골드만삭스는 매수로 유턴 https://t.co/geaIoV1mtO",2020.12.12
1337835609604308992,달고나쉐이크,"자율주행 카메라, 센서 기술 라이다 레이더 장단점 비교(feat.테슬라 일론 머스크) https://t.co/VwimpBkSoa 출처 @YouTube",2020.12.12
1337830403147612160,임종,"@C_iru__ 아니ㅋㅋㅋ왜요? 왜 안녕하세요지..친숙한 아줌마 이미지였나??? 테슬라: 어..그래, 날 좋아해준다니 고맙게 생각해.",2020.12.12
1337826556476055555,스넥(SNEK) - 경제를 더 재밌게,"스페이스 X 와 테슬라의 수장, 일론 머스크 최근 생각 읽기 https://t.co/q3H7cHYLtS",2020.12.12
1337826472371736577,임종,테슬라 풀게 없어요 놀랍게도 비설 없고,2020.12.12
1337825147500236801,David kang,"# 대힌민국 정말 이상하지 않나요?의문의 테슬라 차량 사고…사망 피해자는 ‘윤석열 친구’ https://t.co/UxbGzT3YZe",2020.12.12
1337808894572154880,RimRim🐯_림림,"며칠전 테슬라 자동차 사고 기사가 생각났다, 사고가 발생하자 문이 열리지 않아 구조하는 데 어려움이 있었다는.",2020.12.12
1337805807778328577,ForceArcher,"Totally agree$SPAC have more opportunities for Robinhooders and retail investors.Traditional IPO is broken$TSLA $SPAC $JKS $NNOX $BTC $ETH $AAPL #테슬라 #애플 $ACB $NIO $SBE $SNOW $FROG $U $NIO $BA $BABA $ZM $UBER $CIIC $THCB $QELL",2020.12.12
1337803633333702657,대한민국,"윤석열, 징계위 속 ‘테슬라 충돌’로 사망한 친구 조문 썩려뤼 고교 대학 동창이자 유일한 술친구라능 후문도  있다능뒈, 대리기사인 동승자는 살았고 썩려뤼 칭구만 주금⁉️ 냄ccc가 나능뒈ㄷㄷhttps://t.co/WBL9ZlIfkv[새.청.사]",2020.12.12
1337803250905432065,신발,음~테슬라귀엽어,2020.12.12
1337792338626678784,임종,하지만 테슬라도 썰려 있었지,2020.12.12
1337792087488483328,임종,사실 진짜 계정들 모두 썰렸을때 테슬라가 오너 손 벗어나서 정말 썰었나 생각했어요,2020.12.12
1337791992877629442,굴비,패컴 혁신기업순위 스냅 ms 테슬라 다음 빅히트 ㅋㅋㅋㅋㅋㅋㅋㅋ,2020.12.12
1337791640895778816,임종,@C_iru__ 아니 깜짝아..  무슨 일 난줄 알았어요ㅋㅋㅋ너무 다급하게 부르시길래..하. 저는 베이 너무 이뻐해서...차마.....베이에게 사랑한다고 전해주세요 테슬라는 종교든 뭐든 알아서하라네요 오너도 그뜻에 따르도록....하고..,2020.12.12
1337780894749270016,임종,"#안녕은_영원한_헤어짐은_아니겠지요#사실_세상은_케이크다#이것이_신화급_난리다#얘들아_밀린일_해야지안녕하세요 후레.....스텝, 테슬라 오너입니다. 러닝 수고 하셨습니다~ 흔적 찾아 갈게요 https://t.co/JLmID8P39u",2020.12.12
1337770130298740740,싸만코맛붕어,@fiyr_fine 테슬라를 이야기하는 것 같아요. 팔콘 도어 때문에 사람 죽은 일도 있고...,2020.12.12
1337768209651359746,레이어드,"테슬라, 인도네시아 본격 진출 : 니켈 확보 전략 https://t.co/fpgdoeJz7t",2020.12.12
1337765960728514572,끼니,테슬라 마시나봐 잘 마네,2020.12.12
1337763281205805056,🇰🇷 최종완(Brian Choi),"테슬라 네비, 티맵 적용 후 변화!https://t.co/zuTzBDKl0w",2020.12.12
1337750298090082304,브램 (반동결),테슬라 전기차 제일 큰 장점 https://t.co/U2XqLsC69Y,2020.12.12
1337737579744006146,리이🍫,"아까 엄마랑 니콜라 테슬라 얘기했는데 국적에 대해서 인식이 달라서 재밌었음ㅋㅋ나(공부함):오스트리아 사람이잖아엄마(크로아티아 다녀옴):아냐 크로아티아 사람이야정답:현재 시점에선 크로아티아 출생인데 당시에는 오스트리아-헝가리 제국 땅이었음ㅋㅋㅋㅋㅋ둘다 정답...",2020.12.12
1337735888793522176,은밀하군,"TESLA조금 더 일찍, 조금 더 많이 들어갔으면 좋았을걸 하고 후회하게 되는 테슬라APPLE뇌동매매 할 때라 애플도 너무 고점에서 샀지만, 아이폰12 시리즈와 에어팟 맥스, 애플워치6 매출이 반영되면 $130은 우습게 뚫을거라 확신하며 되는대로 물량 확보해야지#TESLA #Apple https://t.co/9h4App6IKJ",2020.12.12
1337732089223888899,젠츄앤리얼고구마츄,"니콜라 테슬라: 제작토마스 에디슨: 내 거! https://t.co/bAxYOls6Mz",2020.12.12
1337729103164657664,도자.,테슬라 사라고 이미 예전에 시그널 보내고 점지해줬는데 그 때 안 산 내가 나쁨 https://t.co/Mjo5OrwmjI,2020.12.12
1337726529552359425,평현,"트훔열등생알칼리트훔패러렐트훔트훔로봇트훔너는그저두번트훔하면돼이윽고트훔이된다트훔찾기렛미트훔유트훔B테슬라는트훔중태엽트훔시계콜오브트훔트훔마니아광상곡",2020.12.12
1337726431929847809,| 식빵손잡이수집가,"트훔열등생알칼리트훔너는그저두번트훔하면돼트훔찾기렛미트훔유테슬라는트훔중",2020.12.12
1337724893421391876,대~한~민~국,테슬라 자동차사고로 죽은 윤석열총장 친구.판사출신 윤모 변호사.과연 사고사일까?,2020.12.12
1337719933233348611,다녤이🍀,@etham____ 차 팔아서 테슬라 ㄱㄱ,2020.12.12
1337718803149406208,RS/레아시스,@yondadida ㅇㅇ 엑라드님은 통상이라 그냥가챠에서도 잘 나옴 해금은 메데이아릴리 테슬라 쿠얼 메이브 그런 애들,2020.12.12
1337717752350396418,yoko,더그 도감에 보면 더그가 안보다 요리 잘하고 테슬라보다 잘먹어서 2관왕이란거 너무 귀여움.... 안을 능가하다니... 반대로 말하자면 신기로 요리하는게 아닌 이상 안의 요리를 이길 수는 없다는건가 싶어서 이것도 좋음 ㅋㅋㅋㅋㅋㅋㅋㅋㅋㅋㅋㅋㅋㅋㅋㅋ,2020.12.12
1337717526147391488,Kiriranshero,@yun_seoul 테슬라 주식도 사십시오,2020.12.12
1337716655086923777,김사랑78980454,"카지노게임사이트 바카라게임 테슬라 블랙잭사이트쿠폰 강아지그램 조선호텔 모바일카지노게임 힐튼호텔 반려견그램 명품의류 식보사이트주소 식보사이트  출장만남 출장마사지 출장샵 DluqSaUREsIIhttps://t.co/838uV857Zb",2020.12.12
1337697656609464320,GreekSage,"7년전 나는 자동차의 미래는 전기차와 무인차가 될 것이라고 예측했다.이후 달라진 것은 AlexNet 의 등장으로 인한 AI 의 태동과 @karpathy 의 테슬라 조인으로 (매우 운이 좋게도)전기차&amp;무인차 둘 모두에서 테슬라가 독주하게 된것.",2020.12.12
1337685854643314688,PrayForKorea,"미운놈이 테슬라 사서 타면 테러하기 쉽겠다. 아님 테슬라를 태우거나테슬라 이거 대책 안 세우면망조다 망조",2020.12.12
1337675192017985536,MJ 엠제이,최근 테슬라 숏때문에 다시 주목받고 있는 마이클 버리를 파다가 영화 빅숏을 다시 보고있다.,2020.12.12
1337672304210276352,뭐하지,@0O90O9 테슬라,2020.12.12
1337663886330216448,서산사는칰빠,밖에서는 문 못 연 테슬라가 보여준 전동화의 함정 [김도형 기자의 휴일차(車)담] | 다음뉴스 https://t.co/tbyg2HR1vQ,2020.12.12
1337648377635303424,연합뉴스TV,"경찰 ""화재 난 테슬라 차량 영장 발부돼""https://t.co/Oer8kC6UwG",2020.12.12
1337645065355763712,하늘연,아...왤캐 지상인들 짜증나지 다른애들은 이정도까진 아니었는데 테슬라 왤캐 짜증나지?????우리계란한테 기어오라한거에서 나도같이빡침,2020.12.12
1337644582675234817,투자/주식의 생활화 퇴직 오과장,높은 소득세율 때문?…테슬라 이어 오라클도 '탈 실리콘밸리' (출처 : 아시아경제 | 네이버 뉴스) https://t.co/tQXrfawxRV,2020.12.12
1337640497318297600,실룻🎮🦀🦀,"~ 사이버펑크 2077 ~삼: 이거 중앙선이 있는거야뭐야 길이왤케좁아수국 : 뭐.. 자동주행 없어?삼: 없어 테슬라망했나봐..",2020.12.12
1337637538261942272,레이어드,"일론 머스크 이메일 유출, 테슬라 20년 4분기 실적 기대https://t.co/S77bjldBds",2020.12.12
1337623966974758912,"거기, 내 자리. (나브랜스 오우너)",윗님다음정모에 시노가준테슬라차끌고나오실듯,2020.12.12
1337618290747666432,털,차량 문만 열렸어도…불 끄기도 어려웠던 '테슬라'.. 손잡이 멋있게할라고 저래놨다가 내부에서 화재로 죽어버리네 이 사고로 전세계 테슬라에 문제가 커질것 같은데. (출처 : JTBC | 네이버 뉴스) https://t.co/VoTIp8pOAf,2020.12.12
1337616323744911361,허부키,테슬라 간지버젼ㅋㅋㅋㅋㅋㅋ https://t.co/aOElFaRxjD,2020.12.12
1337612487303200769,(카군) 2023년 11~12월 촬영 절찬리 모집중 / 평일 可 📸,휸다이 문짝에 폭발볼트를 설치한다 그러면 작동 안하면 어쩌나 수준으로 걱정이 끝나는데 테슬라 문짝에 폭발볼트 있다 그러면 차로 마이클 베이 영화 찍을거 같아 무서워진다고...,2020.12.12
1337609329956909056,(카군) 2023년 11~12월 촬영 절찬리 모집중 / 평일 可 📸,근데 폭탄 장착된 테슬라라고 하면 더 불안해지는게... #탑승자는확실히날려버릴듯,2020.12.12
1337605952195837954,쑤즈,"테슬라 수익72프롷ㅎㅎㅎ",2020.12.12
1337602722409951233,레리💗보다는 어둠의 창작자👨‍🎨정도??⍥⃝,나도 돈 많이 벌어서 테슬라 사고 싶어 옵션으로 전문 운전가도 따라오면 좋겟다,2020.12.12
1337602039795298307,레리💗보다는 어둠의 창작자👨‍🎨정도??⍥⃝,우버로 테슬라 타봤는데 완전 쩐다,2020.12.12
1337598180293111808,김동일,&lt;김규환 기자의 차이나 스코프&gt; 테슬라 잡기 위해 벌떼 공격에 나선 중국 전기차 업체들 | 다음 뉴스 https://t.co/fvUAWbIr7e,2020.12.12
1337593936697651202,눈새,이번에 일어난 테슬라사건 관련해서 남친 지인이 같은 시간에 일때문에 같은 시간에 주차장 다른 층에 있었다는데 그 지인이 '내가 그 사람 살려줬어야 인생 피는건데' 하고 얘기를 했다고 한다. 그래서 그 사람이랑은 상종도 하지말라고 했다... 남의 목숨가지고 농담하는 파렴치한이 있다는게 너무,2020.12.12
1337592686379814914,슈슈,"우리나라 사람들 테슬라 주식 엄청 사긴했나봐. 요샌 티비만 틀어도, 라디오만 켜도 일론 머스크가 나오네.",2020.12.12
1337592362986401794,"거기, 내 자리. (나브랜스 오우너)","아니 좆코가 시노앨리스운영 머리어케댄거냐고 테슬라가 경품이라고 해서진심 테슬라여도 시계같은 뭔가다른짜잘한건줄 알앗더니진찌ㆍ 테슬라 차 에다가 뭔가다른게너무많어",2020.12.12
1337591297394135042,PPAPPER,@apricot_log 노하우 차이도 있지만 테슬라쪽은 safe fail 에 대한 개념을 절감요소로 보는거같아,2020.12.12
1337590979830763521,죠시멜로,@minchonang 살상병기를 생산하는 테슬라,2020.12.12
1337590501965398016,민초냉밥,"진짜 테슬라는 차가 아니고 전자기기인듯 ㅋㅋ점점 볼수록 사면 안 되는 물건이다",2020.12.12
1337589861889425409,레이어드,"테슬라 S&amp;P500 편입에 따른 종목교체 발표 https://t.co/RT6idZFbtI",2020.12.12
1337589616904302592,귀네,@ariake https://t.co/uA3OFR1n6A 레벨6 자율주행을 위한 노빠꾸 테슬라 ㄷㄷㄷ,2020.12.12
1337588525743534081,귀네,"야 아무리 그래도 테슬라 = 애플은 좀 아니지애플이 무슨 사용자 목숨을 담보 삼아서 기술 실험이라도 하냐 그냥 물건 좀 비싸게 팔아 먹은 거 뿐이지 ㅋㅋ",2020.12.12
1337586944557993984,ㄱ,자동차가 아니고 테슬라입니다 ㅋㅋ,2020.12.12
1337578034518323201,Camino de Tesla,@LayeredStock 공부하면 몇년간은 팔 필요가 없는 회사인데.. 저도 요즘 부쩍 주변에서 테슬라 사도 되냐고 물어보내요.. 공부해보면 알텐데,2020.12.12
1337567874085314560,모카,"테슬라 주식https://t.co/WtjUMnLPwh",2020.12.12
1337567408395964417,레이어드,"18일 정도에 수익실현에 대해 궁금해 하실 수도 있으실 것 같아서, 말씀드리는 것이지만, 저는 지금도 테슬라가 under-estimated된 상태라고 생각해서 주식을 사는 것이지, S&amp;P500 모멘텀은 부수적인 요소로 생각하고 있습니다. 그래서 수익실현을 할 생각이 전혀 없는 상태입니다.",2020.12.12
1337556321160204288,환해의 꿈나비,"""네, 제레도 테슬라 님과 거의 동시에 일어났어요."" (이벤트)",2020.12.12
1337556041618186240,J_Traveler QQQ,"2) 윤석열 친구 테슬라 사고에 대한 의견들https://t.co/NI6ALvgB2f",2020.12.12
1337556040250916865,J_Traveler QQQ,"1) 윤석열 친구 테슬라 사고에 대한 의견들과연, 진실은 어디 있을까요?https://t.co/zZyBuYgnDX",2020.12.12
1337553903194230786,무궁화꽃이 피였다,테슬라 화재 사망 사고…‘숨은 손잡이’ 구조엔 치명적 (출처 : 채널A | 네이버 뉴스) https://t.co/lQhHGs4ymX,2020.12.12
1337553874526224385,무궁화꽃이 피였다,"테슬라 화재 사망 사고…‘숨은 손잡이’ 구조엔 치명적 (출처 : 채널A | 네이버 뉴스) https://t.co/lQhHGs4ymX최신형 전자시스템으로 만들어진 차량에 우리나라는 사고후 지식인지 미흡으로 문도 못열어 밖에서는 주인의 인지 없이는 못열어 대리운전자도 지식 전무해 안에서도 못열다니 창피",2020.12.12
1337550282067070977,[필름],"차 문짝 밖에서는 전자식으로 열어도 안에선 손으로 쉽게 열 수 있도록 만들어야지 테슬라는 기본이 안 되어있는듯누가 위급상황에 재빨리 스피커 트림 뜯어서 손잡이 잡아당기냐 모든 탑승자가 해당 모델의 긴급탈출 레버 위치를 알고 있어야 하나",2020.12.12
1337540118597443584,Heon,@mujica_OMG 테슬라 대쥬쥬...,2020.12.11
